{
  "schema_version": "0.2.0",
  "sample_id": "fixture:clamp-value-v2",
  "source_dataset": "synthetic_fixture",
  "source_revision": "fixture-v2",
  "repo_id": "fixture/clamp-value",
  "repo_family": "fixture/clamp-value",
  "base_commit": "2222222",
  "fix_commit": "3333333",
  "language": "cpp",
  "task_level": "function",
  "edit_type": "multi_line_local",
  "changed_logical_lines": 4,
  "problem_statement": "clamp must honor both bounds",
  "failure_evidence": "values above the upper bound are returned unchanged",
  "context": {
    "target_file": "src/clamp.cpp",
    "target_symbol": "clamp_value",
    "start_line": 10,
    "end_line": 16,
    "buggy_code": "int clamp_value(int x, int lo, int hi) {\n  if (x < lo) return lo;\n  return x;\n}"
  },
  "file_window_lines": null,
  "file_window_context_before": null,
  "file_window_context_after": null,
  "input_token_count": 196,
  "allowed_paths": ["src/clamp.cpp"],
  "gold_patch": null,
  "build_command": ["cmake", "--build", "build"],
  "public_test_command": null,
  "hidden_test_command": null,
  "regression_test_command": null,
  "public_test_count": 0,
  "hidden_test_count": 0,
  "regression_test_count": 0,
  "timeout_seconds": 60,
  "license": "CC0-1.0",
  "split": "train",
  "provenance_hash": "sha256:2222222222222222222222222222222222222222222222222222222222222222"
}
