{
  "schema_version": "0.2.0",
  "sample_id": "fixture:parse-port-v2",
  "source_dataset": "synthetic_fixture",
  "source_revision": "fixture-v2",
  "repo_id": "fixture/parse-port",
  "repo_family": "fixture/parse-port",
  "base_commit": "4444444",
  "fix_commit": "5555555",
  "language": "cpp",
  "task_level": "file_window",
  "edit_type": "add_helper",
  "changed_logical_lines": 8,
  "problem_statement": "port parsing must reject trailing characters",
  "failure_evidence": "parse_port accepts 80junk as port 80",
  "context": {
    "target_file": "src/config.cpp",
    "target_symbol": "parse_port",
    "start_line": 20,
    "end_line": 27,
    "buggy_code": "namespace config {\nint parse_port(const std::string& text) {\n  return std::stoi(text);\n}\n}"
  },
  "file_window_lines": 120,
  "file_window_context_before": 64,
  "file_window_context_after": 48,
  "input_token_count": 2048,
  "allowed_paths": ["src/config.cpp"],
  "gold_patch": null,
  "build_command": ["cmake", "--build", "build"],
  "public_test_command": null,
  "hidden_test_command": null,
  "regression_test_command": null,
  "public_test_count": 0,
  "hidden_test_count": 0,
  "regression_test_count": 0,
  "timeout_seconds": 90,
  "license": "CC0-1.0",
  "split": "validation",
  "provenance_hash": "sha256:4444444444444444444444444444444444444444444444444444444444444444"
}
