{
  "schema_version": "0.2.0",
  "sample_id": "fixture:deterministic-add-v1",
  "source_dataset": "synthetic_fixture",
  "source_revision": "deterministic-scoring-v1",
  "repo_id": "fixture/deterministic-add",
  "repo_family": "fixture/deterministic-add",
  "base_commit": "d68a0718b4a066cb319e89efc21e5c2af9d1d093",
  "fix_commit": null,
  "language": "cpp",
  "task_level": "function",
  "edit_type": "single_line",
  "changed_logical_lines": 1,
  "problem_statement": "add must return the arithmetic sum of its arguments",
  "failure_evidence": "public and hidden addition checks fail on the buggy revision",
  "context": {
    "target_file": "src/add.cpp",
    "target_symbol": "add",
    "start_line": 1,
    "end_line": 1,
    "buggy_code": "int add(int a, int b) { return a - b; }"
  },
  "file_window_lines": null,
  "file_window_context_before": null,
  "file_window_context_after": null,
  "input_token_count": 128,
  "allowed_paths": ["src/add.cpp"],
  "gold_patch": "--- a/src/add.cpp\n+++ b/src/add.cpp\n@@ -1 +1 @@\n-int add(int a, int b) { return a - b; }\n+int add(int a, int b) { return a + b; }\n",
  "build_command": ["g++", "-std=c++17", "-Wall", "-Wextra", "-pedantic", "src/add.cpp", "tests/test_driver.cpp", "-o", "fixture_test"],
  "public_test_command": ["./fixture_test", "public"],
  "hidden_test_command": ["./fixture_test", "hidden"],
  "regression_test_command": ["./fixture_test", "regression"],
  "public_test_count": 1,
  "hidden_test_count": 1,
  "regression_test_count": 3,
  "timeout_seconds": 30,
  "license": "CC0-1.0",
  "split": "internal_test",
  "provenance_hash": "sha256:d68a0718b4a066cb319e89efc21e5c2af9d1d093000000000000000000000000"
}
